name,positive,negative
Manga,"Pencil drawing {prompt}, Black and White, B&W, Low detail, sketch, concept art, Manga style, Anime style, line art, webtoon, manhua, chalk, hand drawn, defined lines, simple shades, simplistic, manga page, minimalistic","pencil, logo, Glasses, Watermark, bad artist, blur, blurry, text, 3d, bad art, poorly drawn, disfigured, deformed, extra limbs, ugly hands, extra fingers"
Oil Portrait,"modelshoot style of {prompt}, (extremely detailed CG unity 8k wallpaper), professional majestic oil painting by Ed Blinkey, Atey Ghailan, Studio Ghibli, by Jeremy Mann, Greg Manchess, Antonio Moro, trending on ArtStation, trending on pencil sketch of {prompt} CGSociety, Intricate, High Detail, Sharp focus, dramatic, photorealistic painting art by midjourney and greg rutkowski","canvas frame, cartoon, 3d, ((disfigured)), ((bad art)), ((deformed)),((extra limbs)),((close up)),((b&w)), weird colors, blurry, (((duplicate))), ((morbid)), ((mutilated)), [out of frame], extra fingers, mutated hands, ((poorly drawn hands)), ((poorly drawn face)), (((mutation))), (((deformed))), ((ugly)), blurry, ((bad anatomy)), (((bad proportions))), ((extra limbs)), cloned face, (((disfigured))), out of frame, ugly, extra limbs, (bad anatomy), gross proportions, (malformed limbs), ((missing arms)), ((missing legs)), (((extra arms))), (((extra legs))), mutated hands, (fused fingers), (too many fingers), (((long neck))), Photoshop, video game, ugly, tiling, poorly drawn hands, poorly drawn feet, poorly drawn face, out of frame, mutation, mutated, extra limbs, extra legs, extra arms, disfigured, deformed, cross-eye, body out of frame, blurry, bad art, bad anatomy, 3d render"
Sketch,"Sketch of {prompt}, Manga Sketch, Pencil drawing, Black and White, Manga, Manga style, Low detail, Line art, vector art, Monochromatic, by katsuhiro otomo and masamune shirow and studio ghilibi and yukito kishiro","pencil, logo, Glasses, Watermark, bad artist, blur, blurry, text, 3d, bad art, poorly drawn, disfigured, deformed, extra limbs, ugly hands, extra fingers"
5yo drawing,A drawing of {prompt} by a 5yo,"Photo, realistic, paper, pencil,canvas"
Oil painting,Realistic and very detailed oil painting of {prompt},"Blurry, sketch, deformed"
Enhance,"breathtaking {prompt}, award-winning, professional, highly detailed","ugly, deformed, noisy, blurry, distorted, grainy"
Anime,"anime artwork {prompt}, anime style, key visual, vibrant, studio anime, highly detailed","photo, deformed, black and white, realism, disfigured, low contrast"
Photographic,"cinematic photo {prompt}, 35mm photograph, film, bokeh, professional, 4k, highly detailed","drawing, painting, crayon, sketch, graphite, impressionist, noisy, blurry, soft, deformed, ugly"
Digital art,"concept art {prompt}, digital artwork, illustrative, painterly, matte painting, highly detailed","photo, photorealistic, realism, ugly"
Comic book,"comic {prompt}, graphic illustration, comic art, graphic novel art, vibrant, highly detailed","photograph, deformed, glitch, noisy, realistic, stock photo"
Fantasy art,"ethereal fantasy concept art of {prompt}, magnificent, celestial, ethereal, painterly, epic, majestic, magical, fantasy art, cover art, dreamy","photographic, realistic, realism, 35mm film, dslr, cropped, frame, text, deformed, glitch, noise, noisy, off-center, deformed, cross-eyed, closed eyes, bad anatomy, ugly, disfigured, sloppy, duplicate, mutated, black and white"
Analog film,"analog film photo {prompt}, faded film, desaturated, 35mm photo, grainy, vignette, vintage, Kodachrome, Lomography, stained, highly detailed, found footage","painting, drawing, illustration, glitch, deformed, mutated, cross-eyed, ugly, disfigured"
Neonpunk,"neonpunk style {prompt}, cyberpunk, vaporwave, neon, vibes, vibrant, stunningly beautiful, crisp, detailed, sleek, ultramodern, magenta highlights, dark purple shadows, high contrast, cinematic, ultra detailed, intricate, professional","painting, drawing, illustration, glitch, deformed, mutated, cross-eyed, ugly, disfigured"
Isometric,"isometric style {prompt}, vibrant, beautiful, crisp, detailed, ultra detailed, intricate","deformed, mutated, ugly, disfigured, blur, blurry, noise, noisy, realistic, photographic"
Lowpoly,"low-poly style {prompt}, low-poly game art, polygon mesh, jagged, blocky, wireframe edges, centered composition","noisy, sloppy, messy, grainy, highly detailed, ultra textured, photo"
Origami,"origami style {prompt}, paper art, pleated paper, folded, origami art, pleats, cut and fold, centered composition","noisy, sloppy, messy, grainy, highly detailed, ultra textured, photo"
Line art,"line art drawing {prompt}, professional, sleek, modern, minimalist, graphic, line art, vector graphics","anime, photorealistic, 35mm film, deformed, glitch, blurry, noisy, off-center, deformed, cross-eyed, closed eyes, bad anatomy, ugly, disfigured, mutated, realism, realistic, impressionism, expressionism, oil, acrylic"
Craft clay,"play-doh style {prompt}, sculpture, clay art, centered composition, Claymation","sloppy, messy, grainy, highly detailed, ultra textured, photo"
Cinematic,"cinematic film still {prompt}, shallow depth of field, vignette, highly detailed, high budget Hollywood movie, bokeh, cinemascope, moody, epic, gorgeous, film grain, grainy","anime, cartoon, graphic, text, painting, crayon, graphite, abstract, glitch, deformed, mutated, ugly, disfigured"
3d-model,"professional 3d model {prompt}, octane render, highly detailed, volumetric, dramatic lighting","ugly, deformed, noisy, low poly, blurry, painting"
pixel art,"pixel-art {prompt}, low-res, blocky, pixel art style, 8-bit graphics","sloppy, messy, blurry, noisy, highly detailed, ultra textured, photo, realistic"
Texture,"texture {prompt} top down close-up","ugly, deformed, noisy, blurry"
Space art,"galactic style {prompt}, nebula, constellation, cosmic, celestial, highly detailed, starry","blurry, grainy, deformed, photo-realistic, low-contrast, terrestrial"
Street art,"urban graffiti style {prompt}, vibrant, edgy, street art, underground, spray paint effect","clean, minimalistic, soft, gentle, blurry, off-center"
Baroque,"Baroque art {prompt}, ornate, richly detailed, dramatic, high contrast, complex composition","minimalistic, low-contrast, blurry, deformed, modern, abstract"
Abstract,"abstract {prompt}, imaginative, surreal, non-representational, dream-like","realistic, photo, literal, symmetrical, rigid"
Pointillism,"pointillism art {prompt}, dots, dappled, stipples, highly detailed","smooth, blurry, photo-realistic, non-dotted"
Impressionist,"impressionist painting {prompt}, soft edges, vibrant, loose brushwork, atmospheric, highly detailed","hard edges, muted colors, tight brushwork, non-atmospheric"
Pop art,"pop art {prompt}, vibrant, mass culture, comic style, bold lines, ironic","soft, elegant, high culture, realistic, subtle lines"
Minimalist,"minimalist design {prompt}, clean, simple, restrained, elegant","busy, complex, flamboyant, disfigured"
Art Deco,"art deco {prompt}, opulent, lavish, ornate, symmetrical, geometric","minimalistic, simple, asymmetrical, organic"
Cubist,"cubist {prompt}, abstract, geometric, fragmented, multiple perspectives","realistic, smooth, unbroken, single perspective"
Dada,"dada style {prompt}, absurd, satirical, avant-garde, abstract","serious, traditional, conventional, realistic"
Victorian,"Victorian style {prompt}, elegant, ornate, highly detailed, historical","modern, minimalist, low detail, contemporary"
Art Nouveau,"art nouveau {prompt}, organic, curvilinear, decorative, highly detailed","geometric, straight lines, functional, low detail"
Futuristic,"futuristic {prompt}, advanced, high-tech, sleek, modern","old, low-tech, chunky, historical"
Medieval,"medieval style {prompt}, historical, ornate, religious, gothic","modern, simple, secular, minimalist"
Industrial,"industrial style {prompt}, mechanical, robust, urban, gritty","natural, fragile, rural, clean"
Vaporwave,"vaporwave style {prompt}, retro, neon, pixelated, nostalgic","modern, monochrome, high-resolution, forward-looking"
Horror,"horror style {prompt}, dark, eerie, gothic, macabre","light, cheerful, minimalist, happy"
Gothic,"gothic style {prompt}, dark, mysterious, intricate, moody","light, cheerful, simple, vibrant"
Steampunk,"steampunk style {prompt}, retro, mechanical, detailed, Victorian","modern, digital, minimalist, contemporary"
Retro,"retro style {prompt}, vintage, nostalgic, old-fashioned, highly detailed","modern, futuristic, forward-looking, low detail"
Surrealist,"surrealist {prompt}, dream-like, bizarre, irrational, highly detailed","realistic, mundane, rational, low detail"
Realism,"realism style {prompt}, lifelike, detailed, accurate, representational","abstract, simplistic, inaccurate, non-representational"
Silhouette,"silhouette style {prompt}, minimalist, monochrome, stark, high contrast","detailed, multicolored, soft, low contrast"
Collage,"collage style {prompt}, mixed media, assembled, eclectic, highly detailed","uniform, unvarying, minimalist, low detail"
Watercolor,"watercolor {prompt}, soft, blended, transparent, fluid","hard, unblended, opaque, rigid"
Calligraphy,"calligraphy {prompt}, elegant, flowing, ornate, highly detailed","plain, rigid, simple, low detail"
Expressionist,"expressionist style {prompt}, emotional, intense, vibrant, highly detailed","emotionless, calm, muted, low detail"
Fauvist,"fauvist style {prompt}, bold color, exaggerated, expressive, highly detailed","neutral color, realistic, restrained, low detail"
Renaissance,"Renaissance style {prompt}, classical, humanistic, realistic, highly detailed","modern, abstract, unrealistic, low detail"
Photorealistic,"photorealistic {prompt}, highly detailed, lifelike, precise, accurate","abstract, low detail, unrealistic, inaccurate"
Symbolic,"symbolic style {prompt}, conceptual, representative, allegorical, highly detailed","literal, non-representative, factual, low detail"
Avant-garde,"avant-garde style {prompt}, experimental, innovative, non-traditional","traditional, conventional, classic"
Mosaic,"mosaic style {prompt}, fragmented, assembled, colorful, highly detailed","whole, unbroken, monochrome, low detail"
Trompe l'oeil,"trompe l'oeil style {prompt}, deceptive, 3D effect, realistic, highly detailed","honest, 2D effect, unrealistic, low detail"
Rococo,"rococo style {prompt}, ornate, playful, romantic, pastel, highly detailed","minimalistic, serious, unromantic, dark, low detail"
Macabre,"macabre style {prompt}, dark, eerie, grotesque, highly detailed","light, cheerful, beautiful, low detail"
Satirical,"satirical style {prompt}, humorous, ironic, exaggerated, critical","serious, literal, realistic, complimentary"
Pixelated,"pixelated style {prompt}, retro, low-res, digital, blocky","modern, high-res, organic, smooth"
Futurist,"futurist style {prompt}, dynamic, modern, mechanized, highly detailed","static, historical, organic, low detail"
Primitive,"primitive style {prompt}, raw, simple, naive, highly detailed","refined, complex, sophisticated, low detail"
Byzantine,"Byzantine style {prompt}, rich, ornate, religious, iconic, highly detailed","poor, simple, secular, non-iconic, low detail"
Psychedelic,"psychedelic style {prompt}, vibrant, abstract, distorted, highly detailed","muted, realistic, undistorted, low detail"
Suprematist,"suprematist style {prompt}, geometric, abstract, non-objective, simple","organic, realistic, objective, complex"
Constructivist,"constructivist style {prompt}, industrial, geometric, political, highly detailed","organic, curvilinear, apolitical, low detail"
De Stijl,"de Stijl style {prompt}, abstract, geometric, primary colors,"organic, curvilinear, muted colors, black and white"
Ukiyo-e,"ukiyo-e style {prompt}, woodblock print, vibrant, historical Japanese art, detailed","digital, muted, modern, Western"
Dystopian,"dystopian style {prompt}, bleak, oppressive, futuristic, detailed","utopian, cheerful, historical, low detail"
Biomechanical,"biomechanical style {prompt}, organic meets mechanical, alien, detailed, H,R, Giger-inspired","geometric, earthy, low detail, not H,R, Giger-inspired"
Hyperrealism,"hyperrealistic style {prompt}, ultra-detailed, lifelike, precision, crisp","abstract, low detail, unrealistic, blurry"
Glitch,"glitch style {prompt}, digital error, distorted, cyber, detailed","analog, undistorted, organic, low detail"
Trompe-l'oeil,"trompe-l'oeil style {prompt}, optical illusion, lifelike, 3D effect, detailed","flat, 2D effect, unrealistic, low detail"
Arabesque,"arabesque style {prompt}, geometric patterns, floral, Islamic art, detailed","chaotic, animalistic, non-Islamic art, low detail"
Brutalist,"brutalist style {prompt}, raw, rugged, geometric, concrete, detailed","smooth, delicate, curvilinear, abstract, low detail"
Chiaroscuro,"chiaroscuro style {prompt}, high contrast, dramatic lighting, detailed","low contrast, flat lighting, low detail"
Tenebrism,"tenebrism style {prompt}, dark, dramatic illumination, high contrast, detailed","light, flat lighting, low contrast, low detail"
Romantic,"romantic style {prompt}, emotional, dramatic, nature-focused, detailed","unemotional, flat, city-focused, low detail"
Bauhaus,"bauhaus style {prompt}, functional, geometric, minimal, detailed","ornamental, curvilinear, maximal, low detail"
Art brut,"art brut style {prompt}, raw, outsider art, naive, detailed","refined, mainstream art, sophisticated, low detail"
Metaphysical,"metaphysical style {prompt}, surreal, eerie, uncanny, detailed","realistic, comfortable, familiar, low detail"
Neoplasticism,"neoplasticism style {prompt}, geometric, primary colors, black and white, abstract","organic, muted colors, colorful, realistic"
Hard-edge,"hard-edge style {prompt}, geometric, flat colors, precision, detailed","organic, gradient colors, imprecise, low detail"
Automatism,"automatism style {prompt}, unconscious, spontaneous, abstract, detailed","conscious, planned, realistic, low detail"
Tachisme,"tachisme style {prompt}, gestural, abstract, spontaneous, detailed","controlled, realistic, planned, low detail"
Lyrical abstraction,"lyrical abstraction style {prompt}, emotional, non-figurative, expressive, detailed","unemotional, figurative, restrained, low detail"
Color field,"color field style {prompt}, flat, large fields of color, minimal, detailed","textured, small patches of color, maximal, low detail"
Synthetism,"synthetism style {prompt}, simplified, symbolic, bright colors, detailed","complex, literal, muted colors, low detail"
Cloisonnism,"cloisonnism style {prompt}, bold outlines, flat colors, decorative, detailed","soft outlines, gradient colors, functional, low detail"
Assemblage,"assemblage style {prompt}, three-dimensional, found objects, eclectic, detailed","two-dimensional, traditional materials, uniform, low detail"
Vorticism,"vorticism style {prompt}, geometric, abstract, dynamic, detailed","organic, realistic, static, low detail"
Op art,"op art style {prompt}, optical illusions, geometric, black and white, detailed","no illusions, organic, colorful, low detail"
Divisionism,"divisionism style {prompt}, color theory, dot technique, vibrant, detailed","black and white, smooth technique, muted, low detail"
Kinetic art,"kinetic art style {prompt}, movement, dynamic, interactive, detailed","static, static, non-interactive, low detail"
Orphism,"orphism style {prompt}, pure color, abstract, musical, detailed","mixed color, realistic, non-musical, low detail"
Suprematism,"suprematism style {prompt}, geometric, abstract, limited color palette, detailed","organic, realistic, broad color palette, low detail"
Letterism,"letterism style {prompt}, letters, typographic, abstract, detailed","images, non-typographic, realistic, low detail"
Situationalist,"situationalist style {prompt}, political, collage, detournement, detailed","apolitical, single medium, straightforward, low detail"
Sound art,"sound art style {prompt}, auditory, abstract, non-visual, detailed","visual, realistic, silent, low detail"
Land art,"land art style {prompt}, natural materials, outdoor, environmental, detailed","synthetic materials, indoor, non-environmental, low detail"
Photorealistic graffiti,"photorealistic graffiti style {prompt}, urban, street art, lifelike, detailed","rural, gallery art, abstract, low detail"
Hypermodern,"hypermodern style {prompt}, postmodern, technology focused, sleek, detailed","premodern, nature focused, rustic, low detail"
Virtual realism,"virtual realism style {prompt}, digital, lifelike, immersive, detailed","analog, abstract, non-immersive, low detail"
Structural film,"structural film style {prompt}, experimental, non-narrative, texture, detailed","traditional, narrative, smooth, low detail"
Process art,"process art style {prompt}, creation focused, ephemeral, documentation, detailed","result focused, permanent, no documentation, low detail"
Light and space,"light and space style {prompt}, perceptual phenomena, immersive, minimal, detailed","solid objects, non-immersive, maximal, low detail"
Post-internet,"post-internet style {prompt}, digital culture, technology, online, detailed","pre-internet, nature, offline, low detail"
Bio-art,"bio-art style {prompt}, living organisms, ethical, natural, detailed","inorganic, unethical, synthetic, low detail"
Byzantine,"Byzantine style {prompt}, religious, iconography, gold, highly detailed, mosaics","secular, simple, bronze, minimalist, paintings"
Celtic,"Celtic style {prompt}, geometric patterns, intricate knots, medieval, highly detailed","random, simplistic, modern, undetailed"
Native American,"Native American style {prompt}, traditional patterns, tribal, cultural symbols, highly detailed","modern, non-tribal, abstract, undetailed"
Aboriginal,"Aboriginal style {prompt}, dot painting, Dreamtime stories, Australian culture, highly detailed","non-Australian, line drawing, abstract, undetailed"
Egyptian,"Egyptian style {prompt}, hieroglyphs, gods and goddesses, Pharaohs, highly detailed","non-Egyptian, text-free, secular, undetailed"
Mayan,"Mayan style {prompt}, glyphs, ancient civilization, detailed carvings, highly detailed","modern, non-Mayan, simplistic, undetailed"
Renaissance,"Renaissance style {prompt}, humanism, realism, perspective, highly detailed","abstract, surreal, flat, undetailed"
Mughal,"Mughal style {prompt}, Indian and Persian influence, miniature paintings, highly detailed","non-Indian, non-Persian, large-scale, undetailed"
Romanesque,"Romanesque style {prompt}, medieval, religious, thick walls, highly detailed","modern, secular, transparent, undetailed"
Gothic,"Gothic style {prompt}, medieval, pointed arches, stained glass, highly detailed","modern, round arches, clear glass, undetailed"
Baroque,"Baroque style {prompt}, grandeur, drama, chiaroscuro, highly detailed","minimalist, calm, flat, undetailed"
Rococo,"Rococo style {prompt}, ornate, pastel, love and nature themes, highly detailed","simple, dark, abstract, undetailed"
Pre-Raphaelite,"Pre-Raphaelite style {prompt}, romantic, vivid color, medieval subjects, highly detailed","realistic, muted color, modern subjects, undetailed"
Impressionist,"Impressionist style {prompt}, loose brushwork, light and color, ordinary subjects, highly detailed","tight brushwork, black and white, extraordinary subjects, undetailed"
Cubist,"Cubist style {prompt}, geometric, multi-perspective, fragmented, highly detailed","organic, single perspective, whole, undetailed"
Surrealist,"Surrealist style {prompt}, dreamlike, irrational, unexpected juxtapositions, highly detailed","realistic, rational, expected combinations, undetailed"
Futurist,"Futurist style {prompt}, dynamic, technology, speed, highly detailed","static, nature, slow, undetailed"
Dada,"Dada style {prompt}, absurd, anti-art, randomness, highly detailed","rational, pro-art, order, undetailed"
Expressionist,"Expressionist style {prompt}, emotional, distorted, individual perspective, highly detailed","unemotional, realistic, collective perspective, undetailed"
Fauvist,"Fauvist style {prompt}, bold color, wild brushwork, simplification, highly detailed","muted color, careful brushwork, detail, undetailed"
Socialist Realist,"Socialist Realist style {prompt}, idealized, political, proletarian, highly detailed","realistic, apolitical, bourgeois, undetailed"
Pop Art,"Pop Art style {prompt}, popular culture, advertising, bold, highly detailed","high art, non-commercial, muted, undetailed"
Suprematism,"Suprematism style {prompt}, geometric, non-objective, primary colors, highly detailed","organic, objective, pastel colors, undetailed"
Symbolist,"Symbolist style {prompt}, mythical, dreamy, spiritual, highly detailed","realistic, practical, secular, undetailed"
Pre-Columbian,"Pre-Columbian style {prompt}, ancient Americas, native, cultural, highly detailed","modern, non-American, abstract, undetailed"
Constructivist,"Constructivist style {prompt}, industrial, geometric, socialist, highly detailed","organic, round, capitalist, undetailed"
Art Nouveau,"Art Nouveau style {prompt}, decorative, nature-inspired, curved lines, highly detailed","functional, geometric, straight lines, undetailed"
Precisionist,"Precisionist style {prompt}, industrial, crisp, geometric, highly detailed","organic, blurry, round, undetailed"
Neoclassical,"Neoclassical style {prompt}, ancient Rome and Greece, rational, heroic, highly detailed","modern, emotional, ordinary, undetailed"
Persian Miniature,"Persian Miniature style {prompt}, Middle Eastern, intricate, storytelling, highly detailed","Western, simple, non-narrative, undetailed"
Edo,"Edo style {prompt}, Japanese, woodblock prints, floating world, highly detailed","non-Japanese, oil painting, real world, undetailed"
Tribal,"Tribal style {prompt}, African, indigenous, symbolic, highly detailed","non-African, mainstream, abstract, undetailed"
Tibetan Thangka,"Tibetan Thangka style {prompt}, spiritual, Buddhist, meditation, highly detailed","secular, non-Buddhist, disturbing, undetailed"
Art Deco,"Art Deco style {prompt}, modern, geometric, luxury, highly detailed","vintage, organic, minimalism, undetailed"
Minimalist,"Minimalist style {prompt}, simple, functional, unadorned, highly detailed","complex, decorative, adorned, undetailed"
Greek Classical,"Greek Classical style {prompt}, ancient, mythology, balanced, highly detailed","modern, everyday life, unbalanced, undetailed"
African,"African style {prompt}, tribal, symbolic, cultural, highly detailed","non-African, abstract, non-cultural, undetailed"
Russian Iconography,"Russian Iconography style {prompt}, religious, orthodox, gold, highly detailed","secular, non-orthodox, silver, undetailed"
Nordic,"Nordic style {prompt}, Scandinavian, minimal, nature, highly detailed","non-Scandinavian, maximal, urban, undetailed"
Inuit,"Inuit style {prompt}, Arctic, native, animal themes, highly detailed","tropical, non-native, human themes, undetailed"
Maori,"Maori style {prompt}, New Zealand, tribal, spiritual, highly detailed","non-New Zealand, non-tribal, secular, undetailed"
Iznik,"Iznik style {prompt}, Turkish, ceramic, floral, highly detailed","non-Turkish, canvas, geometric, undetailed"
Ottoman,"Ottoman style {prompt}, Islamic, calligraphy, miniatures, highly detailed","non-Islamic, typography, large-scale, undetailed"
Hanami,"Hanami style {prompt}, Japanese, cherry blossoms,spring, highly detailed","non-Japanese, winter, abstract, undetailed"
Mandala,"Mandala style {prompt}, spiritual, geometric, symmetrical, highly detailed","secular, organic, asymmetrical, undetailed"
Aztec,"Aztec style {prompt}, ancient Mexico, symbolic, cultural, highly detailed","modern, abstract, non-cultural, undetailed"
Sumi-e,"Sumi-e style {prompt}, Japanese ink painting, minimal, nature, highly detailed","non-Japanese, colorful, urban, undetailed"
Ukiyo-e,"Ukiyo-e style {prompt}, Japanese, woodblock prints, floating world, highly detailed","non-Japanese, digital art, real world, undetailed"
Haida,"Haida style {prompt}, Native American, form line, nature, highly detailed","non-Native American, abstract, urban, undetailed"
Moorish,"Moorish style {prompt}, Islamic, geometric, Andalusian, highly detailed","non-Islamic, organic, non-Andalusian, undetailed"
Victorian,"Victorian style {prompt}, 19th century, ornate, romantic, highly detailed","21st century, minimal, unemotional, undetailed"
Pueblo,"Pueblo style {prompt}, Native American, traditional, pottery, highly detailed","non-Native American, modern, photography, undetailed"
Cloisonne,"Cloisonne style {prompt}, metalwork, enamel, intricate, highly detailed","woodwork, paint, simple, undetailed"
Khokhloma,"Khokhloma style {prompt}, Russian, folk art, floral, highly detailed","non-Russian, fine art, geometric, undetailed"
Biedermeier,"Biedermeier style {prompt}, 19th century, domestic, unpretentious, highly detailed","21st century, public, pretentious, undetailed"
Goryeo,"Goryeo style {prompt}, Korean, celadon, inlay, highly detailed","non-Korean, terra cotta, relief, undetailed"
Han,"Han style {prompt}, Chinese, ancient, stone relief, highly detailed","non-Chinese, modern, oil painting, undetailed"
Hellenistic,"Hellenistic style {prompt}, ancient Greek, dynamic, emotional, highly detailed","modern, static, unemotional, undetailed"
Tang,"Tang style {prompt}, Chinese, ancient, sculpture, highly detailed","non-Chinese, modern, photography, undetailed"
Ming,"Ming style {prompt}, Chinese, elegant, pottery, highly detailed","non-Chinese, rustic, painting, undetailed"
Joseon,"Joseon style {prompt}, Korean, Confucian, painting, highly detailed","non-Korean, Taoist, sculpture, undetailed"
Gupta,"Gupta style {prompt}, Indian, ancient, sculpture, highly detailed","non-Indian, modern, painting, undetailed"
Pallava,"Pallava style {prompt}, Indian, Dravidian architecture, sculpture, highly detailed","non-Indian, Mughal architecture, painting, undetailed"
