name,positive,negative
Honey Boy,"Honey Boy {prompt}, Drama, father-son relationship, Hollywood, highly detailed","romantic comedy, mother-daughter relationship, a small town, undetailed"
Joker,"Joker {prompt}, Drama, mental health, Gotham City, highly detailed","romantic comedy, mental well-being, Metropolis, undetailed"
Uncut Gems,"Uncut Gems {prompt}, Crime, gambling, New York City's Diamond District, highly detailed","romantic comedy, savings, rural town, undetailed"
1917,"1917 {prompt}, War, World War I, real-time, highly detailed","romantic comedy, peacetime, timeless, undetailed"
Ford v Ferrari,"Ford v Ferrari {prompt}, Drama, racing, corporate politics, highly detailed","romantic comedy, walking, friendship, undetailed"
Cats,"Cats {prompt}, Musical, anthropomorphic cats, surreal, highly detailed","action, ordinary humans, realism, undetailed"
Jojo Rabbit,"Jojo Rabbit {prompt}, Comedy-drama, World War II, Hitler Youth, highly detailed","romantic comedy, modern day, ordinary youth, undetailed"
Parasite,"Parasite {prompt}, Drama, social class, deception, highly detailed","romantic comedy, equality, honesty, undetailed"
The Lion King,"The Lion King {prompt}, Animated, animal kingdom, Shakespearean, highly detailed","live-action, human kingdom, modern, undetailed"
Aladdin,"Aladdin {prompt}, Animated, Middle Eastern, magic, highly detailed","live-action, Western, science, undetailed"
Toy Story 4,"Toy Story 4 {prompt}, Animated, toys, adventure, highly detailed","live-action, non-living objects, ordinary life, undetailed"
Avengers: Endgame,"Avengers: Endgame {prompt}, Superhero, epic, time travel, highly detailed","romantic comedy, small-scale, present day, undetailed"
Star Wars: The Rise of Skywalker,"Star Wars: The Rise of Skywalker {prompt}, Sci-fi, space opera, Jedi, highly detailed","romantic comedy, earthbound, everyday person, undetailed"
Downton Abbey,"Downton Abbey {prompt}, Drama, British aristocracy, period piece, highly detailed","romantic comedy, modern middle class, present day, undetailed"
Frozen 2,"Frozen 2 {prompt}, Animated, fairytale, sisterhood, highly detailed","live-action, realism, rivalry, undetailed"
Little Women,"Little Women {prompt}, Drama, sisters, Civil War era, highly detailed","action, brothers, modern day, undetailed"
2D Traditional Animation,"traditional 2D animation {prompt}, hand-drawn, frames, expressive, vibrant colors, highly detailed","3D, CG, stop-motion, photo-realistic, black and white"
CGI Animation,"CGI animation {prompt}, 3D, photorealistic, high-quality textures and lighting, highly detailed","2D, stop-motion, anime, manga, black and white"
Stop-Motion Animation,"stop-motion animation {prompt}, physical models, frame-by-frame, quirky, distinctive, highly detailed","2D, 3D, CG, anime, manga, black and white"
Claymation,"claymation {prompt}, clay models, stop-motion, handcrafted, tactile, highly detailed","2D, 3D, CG, anime, manga, black and white"
Vector Animation,"vector animation {prompt}, digital, clean lines, geometric shapes, bold colors, highly detailed","stop-motion, claymation, 3D, CG, black and white"
Flash Animation,"flash animation {prompt}, digital, vector graphics, tweening, simple shapes, highly detailed","stop-motion, claymation, 3D, CG, black and white"
Rotoscope Animation,"rotoscope animation {prompt}, traced over live-action, realistic movement, highly detailed","stop-motion, claymation, 3D, CG, black and white"
Cut-Out Animation,"cut-out animation {prompt}, paper or fabric cut-outs, stop-motion, handcrafted, highly detailed","2D, 3D, CG, anime, manga, black and white"
Sand Animation,"sand animation {prompt}, sand manipulated on light box, fluid movement, highly detailed","2D, 3D, CG, anime, manga, black and white"
Pixel Art Animation,"pixel art animation {prompt}, low-res, blocky, digital, 8-bit, highly detailed","stop-motion, claymation, 3D, CG, black and white"
Anime Style Animation,"anime style animation {prompt}, Japanese style, hand-drawn or digital, vibrant, unique character designs, highly detailed","western cartoons, 3D, CG, black and white"
Manga Style Art,"manga style {prompt}, Japanese comics, black and white, unique character designs, detailed backgrounds, highly detailed","western comics, 3D, CG, vibrant colors"
Chibi Style Art,"chibi style {prompt}, Japanese, super-deformed, cute, exaggerated features, vibrant colors, highly detailed","realistic, 3D, CG, western comics, black and white"
Superflat,"superflat {prompt}, Japanese, postmodern art, flat planes of color, manga and anime influences, highly detailed","3D, CG, western art styles, black and white"
Ukiyo-e,"ukiyo-e style {prompt}, Japanese woodblock prints, flat areas of color, detailed patterns, subjects from history and mythology, highly detailed","modern, 3D, CG, western art styles, black and white"
Western Comics Art,"western comics art {prompt}, bold lines, dynamic poses, vibrant colors, dramatic lighting, highly detailed","anime, manga, 3D, CG, black and white"
Graphic Novel Art,"graphic novel art {prompt}, detailed, expressive, ranges from black and white to full color, often more realistic than traditional comics, highly detailed","anime, manga, 3D, CG, western comics"
Cartoon Modern,"cartoon modern {prompt}, mid-century modern aesthetic, stylized, geometric shapes, flat colors, highly detailed","realistic, 3D, CG, anime, manga, black and white"
Abstract Animation,"abstract animation {prompt}, nonrepresentational, uses movement and color to create mood or emotion, highly detailed","realistic, 3D, CG, anime, manga, black and white"
Silhouette Animation,"silhouette animation {prompt}, black figures against light background, dramatic, based on shadow puppetry, highly detailed","colorful, 3D, CG, anime, manga, black and white"
Looney Tunes,"Looney Tunes {prompt}, Cartoon, slapstick humor, dynamic and exaggerated character designs, colorful, vibrant, whimsical","3D, realism, manga, black and white, subdued, serious"
Disney Classic,"Disney Classic {prompt}, Animation, fairy tales, musical numbers, expressive characters, bright colors, detailed, professional","manga, anime, black and white, sketchy, rough"
Studio Ghibli,"Studio Ghibli {prompt}, Anime, magical realism, environmental themes, unique characters, breathtaking landscapes, highly detailed","cartoon, slapstick, black and white, photo-realistic, barren"
Pixar,"Pixar {prompt}, 3D animation, heartwarming stories, photorealistic environments, appealing character designs, emotional depth, detailed, professional","2D, anime, manga, black and white, sketchy"
Shonen,"Shonen {prompt}, Manga, action-packed, youthful characters, dynamic battles, inspiring themes, highly detailed","Disney, Pixar, black and white, realism, romantic comedy"
Mecha,"Mecha {prompt}, Anime, robots, futuristic technologies, dynamic battles, detailed mechanical designs, highly detailed","Disney, Pixar, cartoon, Looney Tunes, realism, fairy tales"
Shojo,"Shojo {prompt}, Manga, romantic themes, delicate art style, emotional narratives, highly detailed","action, mecha, 3D, Pixar, black and white, barren"
Nickelodeon,"Nickelodeon {prompt}, Cartoon, humor, dynamic characters, wacky and colorful designs, highly detailed","anime, manga, black and white, sketchy, serious"
Cartoon Network,"Cartoon Network {prompt}, Cartoon, humor, dynamic characters, unique and abstract designs, highly detailed","anime, manga, black and white, sketchy, serious"
Adult Swim,"Adult Swim {prompt}, Animation, adult humor, surreal themes, unique and abstract designs, highly detailed","children's cartoons, Disney, fairy tales, bright colors, traditional"
Adventure Time,"Adventure Time {prompt}, Cartoon, fantasy themes, quirky characters, vibrant colors, highly detailed","anime, manga, black and white, sketchy, serious"
Rick and Morty,"Rick and Morty {prompt}, Cartoon, science fiction, adult humor, unique and abstract designs, highly detailed","children's cartoons, Disney, fairy tales, bright colors, traditional"
South Park,"South Park {prompt}, Animation, satire, crude humor, simplistic designs, highly detailed","anime, manga, Disney, Pixar, detailed, professional"
The Simpsons,"The Simpsons {prompt}, Animation, satire, family themes, recognizable yellow characters, highly detailed","anime, manga, Disney, Pixar, black and white"
Family Guy,"Family Guy {prompt}, Animation, adult humor, satirical themes, cartoonish designs, highly detailed","anime, manga, Disney, Pixar, black and white"
Bob's Burgers,"Bob's Burgers {prompt}, Animation, family themes, humor, quirky characters, highly detailed","anime, manga, Disney, Pixar, black and white"
Gravity Falls,"Gravity Falls {prompt}, Cartoon, mystery, fantasy themes, unique character designs, highly detailed","anime, manga, Disney, Pixar, black and white"
Steven Universe,"Steven Universe {prompt}, Cartoon, LGBTQ+ themes, fantasy, vibrant colors, unique character designs, highly detailed","anime, manga, Disney, Pixar, black and white"
One Piece,"One Piece {prompt}, Manga, adventure, pirates, dynamic battles, unique character designs, highly detailed","cartoon, realism, Disney, Pixar, black and white"
Attack on Titan,"Attack on Titan {prompt}, Anime, dystopian, giants, dynamic battles, highly detailed","cartoon, realism, Disney, Pixar, black and white"
My Hero Academia,"My Hero Academia {prompt}, Anime, superhero, high school, dynamic battles, unique character designs, highly detailed","cartoon, realism, Disney, Pixar, black and white"
Naruto,"Naruto {prompt}, Anime, ninjas, coming-of-age, dynamic battles, unique character designs, highly detailed","cartoon, realism, Disney, Pixar, black and white"
Dragon Ball Z,"Dragon Ball Z {prompt}, Anime, martial arts, aliens, dynamic battles, unique character designs, highly detailed","cartoon, realism, Disney, Pixar, black and white"
Sailor Moon,"Sailor Moon {prompt}, Anime, magical girls, romance, unique character designs, highly detailed","cartoon, realism, Disney, Pixar, black and white"
Cowboy Bebop,"Cowboy Bebop {prompt}, Anime, space western, bounty hunters, noir themes, highly detailed","cartoon, realism, Disney, Pixar, black and white"
Van Gogh, "Van Gogh style {prompt}, Expressive, impasto, swirling brushwork, vibrant," "realistic, photorealistic, calm, straight lines"
Warhol, "Warhol style {prompt}, Pop art, bold colors, mass production, repetitive," "subdued colors, traditional, unique, serious"
Picasso, "Picasso style {prompt}, Cubist, geometric, abstract, innovative," "realistic, detailed, smooth, fluid, single perspective"
Da Vinci, "Da Vinci style {prompt}, Realistic, sfumato, detailed, chiaroscuro," "abstract, vibrant colors, bold, loose brushwork"
Monet, "Monet style {prompt}, Impressionist, light-filled, loose brushwork, en plein air," "defined, detailed, subdued, studio work"
Dali, "Dali style {prompt}, Surrealist, dreamlike, bizarre, symbolic," "realistic, ordinary, rational, clear, obvious"
Pollock, "Pollock style {prompt}, Abstract expressionist, gestural, dripping, layered," "sharp, precise, realistic, calm"
Rothko, "Rothko style {prompt}, Color field, abstract, simple, large-scale," "detailed, small, complex, figurative"
Matisse, "Matisse style {prompt}, Fauvist, bold colors, loose, decorative," "realistic, subdued colors, detailed, serious"
Banksy, "Banksy style {prompt}, Street art, satirical, stenciled, urban," "classic, traditional, indoor, realism"
Michelangelo, "Michelinagelo style {prompt}, High Renaissance, sculptural, detailed, humanistic," "abstract, loose, simplistic, impersonal"
Kusama, "Kusama style {prompt}, Pop Art, abstract, polka dots, immersive," "plain, monotone, realistic, sparse"
Hokusai, "Hokusai style {prompt}, Ukiyo-e, woodblock print, detailed, narrative," "abstract, free-form, modern, minimal"
O'Keeffe, "O'Keeffe style {prompt}, Modernist, floral, bold, abstract," "small scale, detailed, muted colors, complex"
Cezanne, "Cezanne style {prompt}, Post-impressionist, geometric, detailed, brushstrokes," "smooth, flat, loose, fluid"
Hopper, "Hopper style {prompt}, Realistic, light and shadow, loneliness, American urban," "busy, crowded, vibrant, abstract"
Klimt, "Klimt style {prompt}, Symbolist, decorative, ornamental, sensual," "simple, bare, abstract, rough"
Chagall, "Chagall style {prompt}, Surrealist, dreamy, vibrant, narrative," "realistic, dull, serious, minimal"
Lichtenstein, "Lichtenstein style {prompt}, Pop art, comic strip, bold, ironic," "realistic, traditional, serious, detailed"
Basquiat, "Basquiat style {prompt}, Neo-expressionist, primitive, graffiti, social commentary," "polished, elegant, subdued, subtle"
Frida Kahlo, "Frida Kahlo style {prompt}, Symbolic, surrealistic, emotional, vibrant," "realistic, subdued, impersonal, monochromatic"
Georgia O'Keeffe, "Georgia O'Keeffe style {prompt}, Modernist, abstract, large scale, organic," "small, detailed, geometric, muted colors"
Jackson Pollock, "Jackson Pollock style {prompt}, Abstract expressionist, action painting, drip technique, energetic," "controlled, figurative, calm, small scale"
Rembrandt, "Rembrandt style {prompt}, Baroque, chiaroscuro, realistic, emotional," "flat lighting, abstract, impersonal, clean"
Renoir, "Renoir style {prompt}, Impressionist, vibrant, lively, warm," "dull, calm, detailed, cool colors"
Magritte, "Magritte style {prompt}, Surrealist, thought-provoking, mysterious, realistic," "abstract, obvious, open, unrefined"
Manet, "Manet style {prompt}, Realistic, impressionistic, bold, contemporary," "abstract, traditional, timid, historical"
Vermeer, "Vermeer style {prompt}, Baroque, detailed, light, tranquil," "abstract, rough, dark, chaotic"
Caravaggio, "Caravaggio style {prompt}, Baroque, chiaroscuro, dramatic, realistic," "soft lighting, calm, abstract, idealized"
Rodin, "Rodin style {prompt}, Realistic, expressive, textured, bronze," "smooth, emotionless, polished, painted"
Botticelli, "Botticelli style {prompt}, Early Renaissance, allegorical, graceful, detailed," "abstract, harsh, simplified, rough"
Edward Hopper, "Edward Hopper style {prompt}, Realistic, isolation, architectural, strong contrast," "crowded, organic, soft lighting, abstract"
Keith Haring, "Keith Haring style {prompt}, Pop art, bold lines, vibrant colors, social messages," "subtle, realistic, muted colors, personal"
Damien Hirst, "Damien Hirst style {prompt}, Contemporary, shocking, conceptual, large scale," "traditional, calming, handcrafted, small scale"
Yayoi Kusama, "Yayoi Kusama style {prompt}, Contemporary, polka dots, immersive, psychedelic," "traditional, plain, minimalist, calm"
Francis Bacon, "Francis Bacon style {prompt}, Existential, distorted, unsettling, expressive," "comforting, realistic, calm, subdued"
Ai Weiwei, "Ai Weiwei style {prompt}, Conceptual, political, traditional Chinese materials, large-scale," "apolitical, contemporary, small-scale, western materials"
Cindy Sherman, "Cindy Sherman style {prompt}, Conceptual, self-portrait, character study, cinematic," "landscape, group portraits, candid, documentary"
Frank Stella, "Frank Stella style {prompt}, Minimalist, geometric, large scale, non-representational," "maximalist, organic, small scale, representational"
Lucian Freud, "Lucian Freud style {prompt}, Realistic, impasto, psychological, intimate," "abstract, smooth, impersonal, public"
Marc Chagall, "Marc Chagall style {prompt}, Dreamlike, vibrant, symbolic, folklore-inspired," "realistic, subdued, literal, modern"
Roy Lichtenstein, "Roy Lichtenstein style {prompt}, Pop art, comic strip influence, bold outlines, primary colors," "abstract, realistic, pastel colors, complex"
Thomas Kinkade, "Thomas Kinkade style {prompt}, Romantic, idealized, warm light, detailed," "abstract, harsh, cool light, minimalist"
Joan Miró, "Joan Miró style {prompt}, Surrealist, abstract, biomorphic forms, primary colors," "realistic, figurative, complex, muted colors"
Gerhard Richter, "Gerhard Richter style {prompt}, Abstract, textured, layered, scraped," "realistic, smooth, single-layer, detailed"
Wassily Kandinsky, "Wassily Kandinsky style {prompt}, Abstract, geometric, vibrant, musical," "realistic, organic, muted, silent"
Norman Rockwell, "Norman Rockwell style {prompt}, Realistic, narrative, Americana, detailed," "abstract, non-narrative, foreign, minimalist"
Bridget Riley, "Bridget Riley style {prompt}, Op art, geometric, black and white, optical illusion," "organic, color, realistic, straightforward"
Piet Mondrian, "Piet Mondrian style {prompt}, De Stijl, geometric, primary colors, black grid," "organic, multiple colors, no grid, curved lines"
Salvador Dali, "Salvador Dali style {prompt}, Surrealist, dreamlike, symbolic, detailed," "realistic, ordinary, literal, sketchy"
Mary Cassatt, "Mary Cassatt style {prompt}, Impressionist, domestic life, soft colors, loose brushwork," "abstract, public life, vibrant colors, precise"
Diego Rivera, "Diego Rivera style {prompt}, Muralist, social realist, Mexican culture, narrative," "miniature, abstract, foreign, non-narrative"
Jean-Michel Basquiat, "Jean-Michel Basquiat style {prompt}, Neo-expressionist, graffiti influence, raw, socially critical," "classical, polished, refined, apolitical"
Henry Moore, "Henry Moore style {prompt}, Abstract, organic, bronze, monumental," "realistic, geometric, miniature, pastel"
Frida Kahlo, "Frida Kahlo style {prompt}, Surrealist, symbolic, vibrant, autobiographical," "realistic, abstract, dull, impersonal"
Grant Wood, "Grant Wood style {prompt}, Regionalist, rural, detailed, Americana," "urban, abstract, vague, non-American"
Edward Hopper, "Edward Hopper style {prompt}, Realistic, isolation, strong light, urban," "impressionistic, crowded, soft light, rural"
Andy Goldsworthy, "Andy Goldsworthy style {prompt}, Environmental art, natural materials, temporary, site-specific," "urban art, man-made materials, permanent, unspecific site"
Louise Bourgeois, "Louise Bourgeois style {prompt}, Abstract, psychological, large-scale, organic," "realistic, impersonal, small-scale, geometric"
Ansel Adams, "Ansel Adams style {prompt}, Black and white, nature, high contrast, detailed," "color, urban, low contrast, vague"
Yoko Ono, "Yoko Ono style {prompt}, Conceptual, minimalist, performance, participatory," "decorative, maximalist, static, non-interactive"
Gustav Klimt, "Gustav Klimt style {prompt}, Symbolist, decorative, golden, intricate," "realistic, functional, monochrome, simplified"
Jeff Koons, "Jeff Koons style {prompt}, Contemporary, kitsch, glossy, large-scale," "traditional, serious, matte, small-scale"
John Singer Sargent, "John Singer Sargent style {prompt}, Realistic, elegant, portrait, expressive," "abstract, casual, landscape, subdued"
Marcel Duchamp, "Marcel Duchamp style {prompt}, Dada, readymade, conceptual, controversial," "traditional, handmade, decorative, safe"
Claude Monet, "Claude Monet style {prompt}, Impressionist, outdoor, light, loose brushwork," "neoclassical, indoor, dark, tight brushwork"
Anish Kapoor, "Anish Kapoor style {prompt}, Abstract, large-scale, reflective, curved," "figurative, small-scale, matte, straight lines"
Hieronymus Bosch, "Hieronymus Bosch style {prompt}, Surrealist, detailed, religious, narrative," "realistic, abstract, secular, non-narrative"
Paul Gauguin, "Paul Gauguin style {prompt}, Post-Impressionist, exotic, bold colors, flat," "Impressionist, familiar, muted colors, volumetric"
Katsushika Hokusai, "Katsushika Hokusai style {prompt}, Ukiyo-e, nature, woodblock print, detailed," "western style, urban, oil painting, abstract"
Pierre-Auguste Renoir, "Pierre-Auguste Renoir style {prompt}, Impressionist, joyful, light, loose brushwork," "neoclassical, somber, dark, tight brushwork"
Antony Gormley, "Antony Gormley style {prompt}, Sculpture, human form, rusted, site-specific," "painting, abstract, polished, gallery-based"
Kazimir Malevich, "Kazimir Malevich style {prompt}, Suprematist, abstract, geometric, minimal," "realistic, organic, decorative, complex"
Jean-Antoine Watteau, "Jean-Antoine Watteau style {prompt}, Rococo, outdoor, elegant, lively," "Baroque, indoor, serious, static"
Constantin Brancusi, "Constantin Brancusi style {prompt}, Modernist, abstract, bronze, streamlined," "traditional, figurative, wood, complex"
Egon Schiele, "Egon Schiele style {prompt}, Expressionist, figure, distorted, emotional," "Impressionist, landscape, proportional, detached"
Nam June Paik, "Nam June Paik style {prompt}, Video art, technological, interactive, large-scale," "painting, traditional, static, small-scale"
James Whistler, "James Whistler style {prompt}, Tonalism, atmospheric, subdued, abstract," "Fauvism, vibrant, bold, detailed"
Wassily Kandinsky, "Wassily Kandinsky style {prompt}, Abstract, musical, geometric, vibrant," "realistic, silent, organic, subdued"
Lucio Fontana, "Lucio Fontana style {prompt}, Spatialism, monochrome, slashed, minimal," "Futurism, colorful, whole, detailed"
Artemisia Gentileschi, "Artemisia Gentileschi style {prompt}, Baroque, dramatic, biblical, female-centric," "Rococo, calm, mythological, male-centric"
Jean Dubuffet, "Jean Dubuffet style {prompt}, Art Brut, textured, primal, abstract," "Academic art, smooth, refined, realistic"
Sandro Botticelli, "Sandro Botticelli style {prompt}, Early Renaissance, mythological, linear, vibrant," "Baroque, historical, painterly, subdued"
Carl Andre, "Carl Andre style {prompt}, Minimalist, geometric, industrial, ground-level," "Baroque, organic, handcrafted, elevated"
David Hockney, "David Hockney style {prompt}, Pop art, landscape, vibrant, digital," "Abstract Expressionism, figure, subdued, traditional"
Cindy Sherman, "Cindy Sherman style {prompt}, Conceptual, self-portrait, character study, cinematic," "landscape, group portraits, candid, documentary"
Jenny Holzer, "Jenny Holzer style {prompt}, Conceptual, text-based, public, LED," "painting, image-based, private, canvas"
Dante Gabriel Rossetti, "Dante Gabriel Rossetti style {prompt}, Pre-Raphaelite, medieval, literary, romantic," "Futurist, modern, abstract, stark"
Zaha Hadid, "Zaha Hadid style {prompt}, Modernist, organic, futuristic, curved," "Classical, geometric, traditional, straight lines"
Takashi Murakami, "Takashi Murakami style {prompt}, Superflat, pop culture, colorful, cartoonish," "Cubist, high culture, monochrome, realistic"
Edward Weston, "Edward Weston style {prompt}, Photography, black and white, still life, detailed," "Painting, color, action, abstract"
Edvard Munch, "Edvard Munch style {prompt}, Expressionist, psychological, bold colors, distorted," "Impressionist, physical, muted colors, proportional"
Ai Weiwei, "Ai Weiwei style {prompt}, Contemporary, political, traditional Chinese materials, large-scale," "Classical, apolitical, modern materials, small-scale"
Georges Braque, "Georges Braque style {prompt}, Cubist, abstract, collage, muted colors," "Romantic, realistic, oil painting, vibrant colors"
Sol LeWitt, "Sol LeWitt style {prompt}, Conceptual, geometric, minimal, instructional," "Expressionist, organic, complex, spontaneous"
Mary Cassatt, "Mary Cassatt style {prompt}, Impressionist, domestic, pastel, feminine," "Realist, urban, oil, masculine"
Damien Hirst, "Damien Hirst style {prompt}, Contemporary, controversial, installation, medical," "Classical, traditional, canvas, floral"
Giuseppe Arcimboldo, "Giuseppe Arcimboldo style {prompt}, Mannerist, portrait, food, symbolic," "Cubist, landscape, abstract, literal"
Yves Klein, "Yves Klein style {prompt}, Nouveau realisme, monochrome, blue, performance," "Pop Art, colorful, red, static"
Frida Kahlo, "Frida Kahlo style {prompt}, Surrealist, autobiographical, vibrant, symbolic," "Realist, historical, muted, literal"
Piet Mondrian, "Piet Mondrian style {prompt}, De Stijl, geometric, primary colors, balanced," "Surrealist, organic, pastel colors, chaotic"
Bridget Riley, "Bridget Riley style {prompt}, Op Art, geometric, black and white, optical," "Impressionist, organic, colorful, static"
Mark Rothko, "Mark Rothko style {prompt}, Abstract Expressionist, color field, large-scale, emotional," "Pop Art, pattern, small-scale, detached"
Joseph Beuys, "Joseph Beuys style {prompt}, Fluxus, performance, social sculpture, felt," "Minimalism, painting, object, metal"
Berthe Morisot, "Berthe Morisot style {prompt}, Impressionist, feminine, domestic, light," "Surrealist, masculine, public, dark"
Agnes Martin, "Agnes Martin style {prompt}, Minimalist, geometric, grid, subtle," "Baroque, organic, floral, bold"
Yayoi Kusama, "Yayoi Kusama style {prompt}, Contemporary, polka dots, infinity rooms, red," "Classical, plain, single room, blue"
Andy Goldsworthy, "Andy Goldsworthy style {prompt}, Environmental, temporary, nature, outdoors," "Industrial, permanent, man-made, indoors"
Henri Cartier-Bresson, "Henri Cartier-Bresson style {prompt}, Photography, decisive moment, black and white, candid," "Painting, posed, color, staged"
Marina Abramovic, "Marina Abramovic style {prompt}, Performance, endurance, audience participation, minimal," "Sculpture, instant, observer, complex"
Man Ray, "Man Ray style {prompt}, Dada, photography, rayograph, experimental," "Realism, painting, traditional, conventional"
Kathe Kollwitz, "Kathe Kollwitz style {prompt}, Expressionist, social realism, black and white, human suffering," "Impressionist, aestheticism, color, human joy"
Robert Rauschenberg, "Robert Rauschenberg style {prompt}, Neo-Dada, combine, mixed-media, assemblage," "Minimalism, singular material, oil painting, separated"
Lyonel Feininger, "Lyonel Feininger style {prompt}, Expressionist, Cubist, architecture, transparent," "Impressionist, organic, landscape, opaque"
Tracey Emin, "Tracey Emin style {prompt}, YBA, confessional, neon, textile," "Old Masters, universal, oil, marble"
Rene Magritte, "Rene Magritte style {prompt}, Surrealist, object, juxtaposition, mystery," "Realist, figure, relation, clarity"
