name,positive,negative
Chola,"Chola style {prompt}, Indian, bronze, dancing Shiva, highly detailed","non-Indian, marble, sitting Buddha, undetailed"
Minoan,"Minoan style {prompt}, ancient Crete, frescoes, sea life, highly detailed","modern, oil painting, land animals, undetailed"
Mycenaean,"Mycenaean style {prompt}, ancient Greece, gold, death mask, highly detailed","modern, bronze, life mask, undetailed"
Ndebele,"Ndebele style {prompt}, African, geometric, house painting, highly detailed","non-African, organic, canvas painting, undetailed"
San,"San style {prompt}, African, rock art, animal figures, highly detailed","non-African, digital art, human figures, undetailed"
Batik,"Batik style {prompt}, Indonesian, resist dyeing, floral, highly detailed","non-Indonesian, direct dyeing, geometric, undetailed"
Assyrian,"Assyrian style {prompt}, ancient Mesopotamia, relief, war scenes, highly detailed","modern, oil painting, peaceful scenes, undetailed"
Thracian,"Thracian style {prompt}, ancient Balkans, gold, ritual objects, highly detailed","modern, wood, everyday objects, undetailed"
Etruscan,"Etruscan style {prompt}, ancient Italy, bronze, mythological scenes, highly detailed","modern, steel, realistic scenes, undetailed"
Sumerian,"Sumerian style {prompt}, ancient Mesopotamia, cuneiform, clay tablets, highly detailed","modern, Latin script, parchment scrolls, undetailed"
Babylonian,"Babylonian style {prompt}, ancient Mesopotamia, law codes, stone steles, highly detailed","modern, lawless, paper books, undetailed"
Norse,"Norse style {prompt}, Viking, runic, wood carving, highly detailed","non-Viking, Latin script, metalwork, undetailed"
Olmec,"Olmec style {prompt}, ancient Mexico, colossal heads, basalt, highly detailed","modern, miniature hands, marble, undetailed"
Toltec,"Toltec style {prompt}, ancient Mexico, monumental architecture, relief, highly detailed","modern, small-scale models, oil painting, undetailed"
Sican,"Sican style {prompt}, ancient Peru, gold masks, funerary objects, highly detailed","modern, wood masks, everyday objects, undetailed"
Nazca,"Nazca style {prompt}, ancient Peru, geoglyphs, desert, highly detailed","modern, graffiti, urban, undetailed"
Inca,"Inca style {prompt}, ancient Peru, stonework, terraces, highly detailed","modern, woodwork, flat plains, undetailed"
Zapotec,"Zapotec style {prompt}, ancient Mexico, urns, jaguars, highly detailed","modern, vases, dogs, undetailed"
Mixtec,"Mixtec style {prompt}, ancient Mexico, codices, turquoise, highly detailed","modern, novels, gold, undetailed"
Ottonian,"Ottonian style {prompt}, medieval Germany, religious art, manuscripts, highly detailed","modern, secular art, newspapers, undetailed"
Merovingian,"Merovingian style {prompt}, medieval France, jewelry, garnet cloisonne, highly detailed","modern, clothing, sapphire pave, undetailed"
Carolingian,"Carolingian style {prompt}, medieval Europe, illuminatedmanuscripts, luxury, highly detailed","modern, paperback books, simplicity, undetailed"
Otomi,"Otomi style {prompt}, Mexican, textile, embroidery, highly detailed","non-Mexican, metalwork, hammering, undetailed"
Huichol,"Huichol style {prompt}, Mexican, yarn painting, spiritual, highly detailed","non-Mexican, oil painting, secular, undetailed"
Ainu,"Ainu style {prompt}, Japanese indigenous, wood carving, bear worship, highly detailed","non-Japanese, stone carving, dragon worship, undetailed"
Maori,"Maori style {prompt}, New Zealand, tattoo, spiritual, highly detailed","non-New Zealand, body paint, secular, undetailed"
Aboriginal,"Aboriginal style {prompt}, Australian indigenous, dot painting, storytelling, highly detailed","non-Australian, line drawing, non-narrative, undetailed"
Inuit,"Inuit style {prompt}, Arctic, stone carving, animal figures, highly detailed","tropical, wood carving, human figures, undetailed"
Saami,"Saami style {prompt}, Nordic indigenous, duodji (craft), reindeer, highly detailed","non-Nordic, factory-made, cow, undetailed"
Ojibwe,"Ojibwe style {prompt}, Native American, birch bark, canoes, highly detailed","non-Native American, pine bark, rafts, undetailed"
Tlingit,"Tlingit style {prompt}, Native American, totem poles, spiritual, highly detailed","non-Native American, street signs, secular, undetailed"
Navajo,"Navajo style {prompt}, Native American, textile, rug weaving, highly detailed","non-Native American, metalwork, jewelry making, undetailed"
Apache,"Apache style {prompt}, Native American, basketry, coiled, highly detailed","non-Native American, pottery, thrown, undetailed"
Zuni,"Zuni style {prompt}, Native American, jewelry, silver, highly detailed","non-Native American, clothing, cotton, undetailed"
Hopi,"Hopi style {prompt}, Native American, kachina dolls, spiritual, highly detailed","non-Native American, action figures, secular, undetailed"
Sioux,"Sioux style {prompt}, Native American, quillwork, porcupine, highly detailed","non-Native American, embroidery, silk, undetailed"
Lakota,"Lakota style {prompt}, Native American, beadwork, clothing, highly detailed","non-Native American, sequin work, banners, undetailed"
Yupik,"Yupik style {prompt}, Native American, mask, ceremonial, highly detailed","non-Native American, mask, recreational, undetailed"
Cherokee,"Cherokee style {prompt}, Native American, pottery, stamped, highly detailed","non-Native American, pottery, painted, undetailed"
Mohawk,"Mohawk style {prompt}, Native American, sweetgrass, basketry, highly detailed","non-Native American, bamboo, basketry, undetailed"
Cree,"Cree style {prompt}, Native American, hide, clothing, highly detailed","non-Native American, synthetic material, clothing, undetailed"
Acoma,"Acoma style {prompt}, Native American, pottery, sky city, highly detailed","non-Native American, pottery, earth city, undetailed"
Laguna,"Laguna style {prompt}, Native American, pottery, polychrome, highly detailed","non-Native American, pottery, monochrome, undetailed"
Seminole,"Seminole style {prompt}, Native American, patchwork, clothing, highly detailed","non-Native American, knitting, clothing, undetailed"
Osage,"Osage style {prompt}, Native American, ribbon work, floral, highly detailed","non-Native American, beadwork, geometric, undetailed"
Anasazi,"Anasazi style {prompt}, Native American, pottery, black-on-white, highly detailed","non-Native American, pottery, color-on-color, undetailed"
Mimbres,"Mimbres style {prompt}, Native American, pottery, figurative, highly detailed","non-Native American, pottery, abstract, undetailed"
Pomo,"Pomo style {prompt}, Native American, basketry, feathers, highly detailed","non-Native American, basketry, beads, undetailed"
Hohokam,"Hohokam style {prompt}, Native American, pottery, red-on-buff, highly detailed","non-Native American, pottery, blue-on-cream, undetailed"
Mississippian,"Mississippian style {prompt}, Native American, stone carving, ceremonial, highly detailed","non-Native American, wood carving, everyday, undetailed"
Fremont,"Fremont style {prompt}, Native American, petroglyphs, rock art, highly detailed","non-Native American, graffiti, wall art, undetailed"
Mogollon,"Mogollon style {prompt}, Native American, pottery, geometric, highly detailed","non-Native American, pottery, organic, undetailed"
Salado,"Salado style {prompt}, Native American, pottery, polychrome, highly detailed","non-Native American, pottery, duochrome, undetailed"
Zulu,"Zulu style {prompt}, African, basketry, coiled, highly detailed","non-African, pottery, thrown, undetailed"
Maasai,"Maasai style {prompt}, African, beadwork, jewelry, highly detailed","non-African, macrame, wall hanging, undetailed"
Ndebele,"Ndebele style {prompt}, African, mural art, homes, highly detailed","non-African, canvas art, studios, undetailed"
Kuba,"Kuba style {prompt}, African, textile, raffia, highly detailed","non-African, metalwork, steel, undetailed"
Yoruba,"Yoruba style {prompt}, African, sculpture, spiritual, highly detailed","non-African, photography, secular, undetailed"
Akan,"Akan style {prompt}, African, gold weights, symbolic, highly detailed","non-African, silver weights, literal, undetailed"
Berber,"Berber style {prompt}, North African, jewelry, silver, highly detailed","non-North African, clothing, cotton, undetailed"
Dogon,"Dogon style {prompt}, African, wood carving, spiritual, highly detailed","non-African, stone carving, secular, undetailed"
Fang,"Fang style {prompt}, African, mask, ceremonial, highly detailed","non-African, mask, recreational, undetailed"
Baga,"Baga style {prompt}, African, mask, spiritual, highly detailed","non-African, mask, secular, undetailed"
Blade Runner,"Blade Runner {prompt}, Cyberpunk, neon-lit, rainy, dystopian, noir, cinematic, highly detailed","bright, sunny, utopian, cheerful, undetailed"
Star Wars,"Star Wars {prompt}, Space opera, galaxy far, far away, epic, iconic, cinematic, highly detailed","earthly, small scale, uniconic, undetailed"
Lord of the Rings,"Lord of the Rings {prompt}, Epic fantasy, Middle-earth, vast landscapes, highly detailed","science fiction, cityscape, undetailed"
Matrix,"Matrix {prompt}, Cyberpunk, green tint, reality-bending, cinematic, highly detailed","rustic, brown tint, reality-based, undetailed"
Indiana Jones,"Indiana Jones {prompt}, Adventure, archaeology, exotic locations, cinematic, highly detailed","domestic, library, unadventurous, undetailed"
Mad Max,"Mad Max {prompt}, Post-apocalyptic, desert landscapes, dystopian, cinematic, highly detailed","utopian, lush landscapes, pre-apocalyptic, undetailed"
2001: A Space Odyssey,"2001: A Space Odyssey {prompt}, Sci-fi, space exploration, monolith, cinematic, highly detailed","fantasy, earth exploration, monochrome, undetailed"
Alien,"Alien {prompt}, Sci-fi horror, space, xenomorphs, dark, highly detailed","comedy, bright, undetailed"
Avatar,"Avatar {prompt}, Sci-fi, Pandora, bioluminescent, 3D, highly detailed","earthly, non-bioluminescent, 2D, undetailed"
Pulp Fiction,"Pulp Fiction {prompt}, Crime, non-linear narrative, 90s, highly detailed","linear narrative, 2000s, undetailed"
Kill Bill,"Kill Bill {prompt}, Martial arts, vengeance, yellow jumpsuit, cinematic, highly detailed","peaceful, pink jumpsuit, undetailed"
Inception,"Inception {prompt}, Sci-fi, dream within a dream, mind-bending, cinematic, highly detailed","reality-based, straightforward, undetailed"
Fight Club,"Fight Club {prompt}, Dark, gritty, psychological drama, highly detailed","light, glossy, undramatic, undetailed"
Harry Potter,"Harry Potter {prompt}, Fantasy, Hogwarts, wizardry, highly detailed","science fiction, non-magical, undetailed"
Marvel Cinematic Universe,"Marvel Cinematic Universe {prompt}, Superheroes, epic battles, colorful, highly detailed","ordinary people, small conflicts, monochrome, undetailed"
DC Extended Universe,"DC Extended Universe {prompt}, Superheroes, grim, darker tones, highly detailed","ordinary people, cheerful, brighter tones, undetailed"
Game of Thrones,"Game of Thrones {prompt}, Fantasy, Westeros, dragons, highly detailed","science fiction, no dragons, undetailed"
Twilight,"Twilight {prompt}, Romantic fantasy, vampires, Pacific Northwest, highly detailed","non-romantic, zombies, desert, undetailed"
Transformers,"Transformers {prompt}, Sci-fi, giant robots, explosions, highly detailed","fantasy, small creatures, calm, undetailed"
The Hunger Games,"The Hunger Games {prompt}, Dystopian, survival, rebellion, highly detailed","utopian, abundance, conformity, undetailed"
Pirates of the Caribbean,"Pirates of the Caribbean {prompt}, Adventure, pirates, supernatural, highly detailed","domestic, non-pirates, realistic, undetailed"
Jurassic Park,"Jurassic Park {prompt}, Adventure, dinosaurs, Isla Nublar, highly detailed","undramatic, no dinosaurs, mainland, undetailed"
The Shining,"The Shining {prompt}, Horror, haunted hotel, psychological thriller, highly detailed","comedy, non-haunted hotel, undetailed"
The Godfather,"The Godfather {prompt}, Crime, mafia, 1940s-1950s, highly detailed","law-abiding, 2000s, undetailed"
The Dark Knight,"The Dark Knight {prompt}, Superhero, gritty, Batman, Joker, highly detailed","light-hearted, Superman, undetailed"
Casablanca,"Casablanca {prompt}, Drama, romance, WWII, highly detailed","action, non-romantic, modern day, undetailed"
Jaws,"Jaws {prompt}, Thriller, shark, Amity Island, highly detailed","comedy, no shark, mainland, undetailed"
The Wizard of Oz,"The Wizard of Oz {prompt}, Fantasy, musical, Technicolor, Oz, highly detailed","realistic, non-musical, monochrome, Kansas, undetailed"
E,T,,"E,T, {prompt}, Sci-fi, family, suburban, highly detailed","fantasy, non-family, urban, undetailed"
Ghostbusters,"Ghostbusters {prompt}, Comedy, supernatural, New York City, highly detailed","horror, natural, rural, undetailed"
Back to the Future,"Back to the Future {prompt}, Sci-fi, time travel, DeLorean, highly detailed","fantasy, time stationary, non-vehicle, undetailed"
Toy Story,"Toy Story {prompt}, Animated, toys come to life, friendship, highly detailed","live-action, inanimate toys, rivalry, undetailed"
The Lion King,"The Lion King {prompt}, Animated, animal kingdom, African savannah, highly detailed","live-action, human kingdom, urban, undetailed"
Finding Nemo,"Finding Nemo {prompt}, Animated, ocean adventure, Great Barrier Reef, highly detailed","live-action, land adventure, desert, undetailed"
Shrek,"Shrek {prompt}, Animated, fairytale, swamp, highly detailed","live-action, realistic, city, undetailed"
The Little Mermaid,"The Little Mermaid {prompt}, Animated, undersea, mermaids, highly detailed","live-action, land, humans, undetailed"
Aladdin,"Aladdin {prompt}, Animated, Arabian Nights, magic carpet, highly detailed","live-action, modern day, ordinary carpet, undetailed"
Beauty and the Beast,"Beauty and the Beast {prompt}, Animated, fairytale, enchanted castle, highly detailed","live-action, realistic, ordinary house, undetailed"
Cinderella,"Cinderella {prompt}, Animated, fairytale, magical transformation, highly detailed","live-action, realistic, ordinary transformation, undetailed"
Sleeping Beauty,"Sleeping Beauty {prompt}, Animated, fairytale, spinning wheel, highly detailed",""live-action, realistic, sewing machine, undetailed"
Snow White,"Snow White {prompt}, Animated, fairytale, seven dwarfs, highly detailed","live-action, realistic, seven giants, undetailed"
Mulan,"Mulan {prompt}, Animated, historical, Chinese warfare, highly detailed","live-action, futuristic, space warfare, undetailed"
Pocahontas,"Pocahontas {prompt}, Animated, historical, Native American, highly detailed","live-action, modern, urban American, undetailed"
The Nightmare Before Christmas,"The Nightmare Before Christmas {prompt}, Stop-motion, Halloween Town, Christmas Town, highly detailed","live-action, Easter Town, undetailed"
Frozen,"Frozen {prompt}, Animated, fairytale, ice magic, highly detailed","live-action, realistic, fire magic, undetailed"
Moana,"Moana {prompt}, Animated, Polynesian, ocean adventure, highly detailed","live-action, Nordic, mountain adventure, undetailed"
Tangled,"Tangled {prompt}, Animated, fairytale, magic hair, highly detailed","live-action, realistic, ordinary hair, undetailed"
Zootopia,"Zootopia {prompt}, Animated, anthropomorphic animals, urban, highly detailed","live-action, humans, rural, undetailed"
Coco,"Coco {prompt}, Animated, Dia de los Muertos, Mexican culture, highly detailed","live-action, Halloween, American culture, undetailed"
Brave,"Brave {prompt}, Animated, Scottish highlands, archery, highly detailed","live-action, tropical island, surfing, undetailed"
Inside Out,"Inside Out {prompt}, Animated, emotions, abstract, highly detailed","live-action, logical thinking, realistic, undetailed"
The Incredibles,"The Incredibles {prompt}, Animated, superhero, family, highly detailed","live-action, villain, solitary, undetailed"
Up,"Up {prompt}, Animated, adventure, flying house, highly detailed","live-action, everyday life, stationary house, undetailed"
Wall-E,"Wall-E {prompt}, Animated, post-apocalyptic, robots, highly detailed","live-action, pre-apocalyptic, humans, undetailed"
Ratatouille,"Ratatouille {prompt}, Animated, culinary, Paris, highly detailed","live-action, non-culinary, New York, undetailed"
Monsters Inc,,"Monsters Inc, {prompt}, Animated, monsters, scare factory, highly detailed","live-action, humans, laughter factory, undetailed"
Cars,"Cars {prompt}, Animated, anthropomorphic cars, racing, highly detailed","live-action, humans, walking, undetailed"
A Bug's Life,"A Bug's Life {prompt}, Animated, insects, ant colony, highly detailed","live-action, mammals, human society, undetailed"
James Bond,"James Bond {prompt}, Spy, action, globe-trotting, highly detailed","romantic comedy, peace, domestic, undetailed"
Fast and Furious,"Fast and Furious {prompt}, Action, car chases, family, highly detailed","romantic comedy, pedestrian chases, solitary, undetailed"
Mission Impossible,"Mission Impossible {prompt}, Action, spy, impossible stunts, highly detailed","romantic comedy, everyday person, possible stunts, undetailed"
Jurassic World,"Jurassic World {prompt}, Adventure, dinosaurs, theme park, highly detailed","romantic comedy, no dinosaurs, city park, undetailed"
Minions,"Minions {prompt}, Animated, comedy, minions, highly detailed","live-action, drama, no minions, undetailed"
Interstellar,"Interstellar {prompt}, Sci-fi, space travel, wormholes, highly detailed","romantic comedy, earth travel, roads, undetailed"
The Grinch,"The Grinch {prompt}, Animated, Christmas, Whoville, highly detailed","live-action, summer, city, undetailed"
Avengers: Endgame,"Avengers: Endgame {prompt}, Superhero, epic battle, time travel, highly detailed","romantic comedy, small conflict, present time, undetailed"
Wonder Woman,"Wonder Woman {prompt}, Superhero, Amazonian, World War I, highly detailed","romantic comedy, non-Amazonian, modern day, undetailed"
The Iron Giant,"The Iron Giant {prompt}, Animated, robot, 1950s, highly detailed","live-action, human, modern day, undetailed"
Godzilla,"Godzilla {prompt}, Monster, destruction, cityscape, highly detailed","romantic comedy, creation, countryside, undetailed"
King Kong,"King Kong {prompt}, Monster, island, skyscraper, highly detailed","romantic comedy, mainland, low-rise, undetailed"
The Grand Budapest Hotel,"The Grand Budapest Hotel {prompt}, Comedy, hotel, pastel colors, highly detailed","action, wilderness, dark colors, undetailed"
Inside Llewyn Davis,"Inside Llewyn Davis {prompt}, Drama, folk music, 1960s, highly detailed","action, pop music, modern day, undetailed"
Drive,"Drive {prompt}, Action, neon, 1980s aesthetic, highly detailed","romantic comedy, daylight, modern aesthetic, undetailed"
The Neon Demon,"The Neon Demon {prompt}, Horror, fashion, Los Angeles, highly detailed","romantic comedy, construction, New York, undetailed"
It Follows,"It Follows {prompt}, Horror, supernatural, suburbia, highly detailed","romantic comedy, natural, city, undetailed"
Dunkirk,"Dunkirk {prompt}, War, World War II, beach, highly detailed","romantic comedy, peace, city, undetailed"
Her,"Her {prompt}, Romance, sci-fi, artificial intelligence, highly detailed","action, reality, human intelligence, undetailed"
The Revenant,"The Revenant {prompt}, Drama, survival, wilderness, highly detailed","romantic comedy, luxury, city, undetailed"
Whiplash,"Whiplash {prompt}, Drama, music, drumming, highly detailed","action, silence, no music, undetailed"
The Shape of Water,"The Shape of Water {prompt}, Fantasy, romance, aquatic creature, highly detailed","action, hatred, terrestrial creature, undetailed"
A Ghost Story,"A Ghost Story {prompt}, Drama, supernatural, ghost, highly detailed","romantic comedy, natural, human, undetailed"
The Florida Project,"The Florida Project {prompt}, Drama, childhood, motel, highly detailed","action, adulthood, skyscraper, undetailed"
La La Land,"La La Land {prompt}, Musical, romance, Los Angeles, highly detailed","action, hatred, New York, undetailed"
The Lobster,"The Lobster {prompt}", Dark comedy, dystopian, relationship rules, highly detailed","romantic comedy, utopian, no relationship rules, undetailed"
Ex Machina,"Ex Machina {prompt}, Sci-fi, artificial intelligence, secluded mansion, highly detailed","romantic comedy, human intelligence, bustling city, undetailed"
Birdman,"Birdman {prompt}, Drama, Broadway, magical realism, highly detailed","action, Hollywood, realism, undetailed"
Gravity,"Gravity {prompt}, Sci-fi, space, survival, highly detailed","romantic comedy, earth, abundance, undetailed"
The Tree of Life,"The Tree of Life {prompt}, Drama, philosophical, nonlinear narrative, highly detailed","action, practical, linear narrative, undetailed"
Inception,"Inception {prompt}, Sci-fi, dream manipulation, heist, highly detailed","romantic comedy, reality, gift-giving, undetailed"
The Social Network,"The Social Network {prompt}, Drama, Facebook, entrepreneurship, highly detailed","action, Myspace, employment, undetailed"
Moonlight,"Moonlight {prompt}, Drama, coming-of-age, Miami, highly detailed","action, aging, Los Angeles, undetailed"
Roma,"Roma {prompt}, Drama, Mexico City, 1970s, highly detailed","action, New York City, modern day, undetailed"
Parasite,"Parasite {prompt}, Thriller, class disparity, South Korea, highly detailed","romantic comedy, class equality, United States, undetailed"
1917,"1917 {prompt}, War, World War I, single shot, highly detailed","romantic comedy, peace, multiple shots, undetailed"
Jojo Rabbit,"Jojo Rabbit {prompt}, Comedy, World War II, imaginary friend, highly detailed","drama, modern day, real friend, undetailed"
Joker,"Joker {prompt}, Drama, psychological, Gotham City, highly detailed","romantic comedy, psychological well-being, Metropolis, undetailed"
The Lighthouse,"The Lighthouse {prompt}, Drama, isolation, lighthouse, highly detailed","romantic comedy, community, city, undetailed"
Once Upon a Time in Hollywood,"Once Upon a Time in Hollywood {prompt}, Comedy-drama, 1960s Hollywood, film industry, highly detailed","action, modern Hollywood, tech industry, undetailed"
The Irishman,"The Irishman {prompt}, Crime, mafia, aging, highly detailed","romantic comedy, law-abiding citizens, youth, undetailed"
Uncut Gems,"Uncut Gems {prompt}, Crime, debt, gambling, highly detailed","romantic comedy, abundance, saving, undetailed"
Little Women,"Little Women {prompt}, Drama, coming-of-age, Civil War era, highly detailed","action, aging, modern day, undetailed"
Knives Out,"Knives Out {prompt}, Mystery, whodunit, wealthy family, highly detailed","romantic comedy, clear culprit, poor family, undetailed"
Marriage Story,"Marriage Story {prompt}, Drama, divorce, bi-coastal, highly detailed","romantic comedy, marriage, same city, undetailed"
Midsommar,"Midsommar {prompt}, Horror, cult, Sweden, highly detailed","romantic comedy, mainstream religion, United States, undetailed"
Booksmart,"Booksmart {prompt}, Comedy, high school, overachievers, highly detailed","drama, college, underachievers, undetailed"
Ford v Ferrari,"Ford v Ferrari {prompt}, Drama, racing, 1960s, highly detailed","romantic comedy, walking, modern day, undetailed"
Rocketman,"Rocketman {prompt}, Musical, biographical, Elton John, highly detailed","action, fictional, ordinary person, undetailed"
Ad Astra,"Ad Astra {prompt}, Sci-fi, space travel, father-son relationship, highly detailed","romantic comedy, earth travel, romantic relationship, undetailed"
Waves,"Waves {prompt}, Drama, family tragedy, forgiveness, highly detailed","romantic comedy, family comedy, grudge, undetailed"
The Farewell,"The Farewell {prompt}, Drama, family, cultural conflict, highly detailed","romantic comedy, strangers, cultural harmony, undetailed"
Hustlers,"Hustlers {prompt}, Drama, strippers, financial crime, highly detailed","romantic comedy, office workers, financial responsibility, undetailed"
Portrait of a Lady on Fire,"Portrait of a Lady on Fire {prompt}, Romance, art, 18th century France, highly detailed","action, science, modern day United States, undetailed"
Pain and Glory,"Painand Glory {prompt}, Drama, filmmaking, memory, highly detailed","romantic comedy, accounting, forgetfulness, undetailed"
The Two Popes,"The Two Popes {prompt}, Drama, Vatican, philosophical discussions, highly detailed","action, a small town, physical challenges, undetailed"
A Beautiful Day in the Neighborhood,"A Beautiful Day in the Neighborhood {prompt}, Drama, Fred Rogers, kindness, highly detailed","action, a villainous character, ruthlessness, undetailed"
The Peanut Butter Falcon,"The Peanut Butter Falcon {prompt}, Adventure, friendship, wrestling, highly detailed","romantic comedy, rivalry, chess, undetailed"
The Goldfinch,"The Goldfinch {prompt}, Drama, art, trauma, highly detailed","action, science, joy, undetailed"
High Life,"High Life {prompt}, Sci-fi, space travel, isolation, highly detailed","romantic comedy, road trip, companionship, undetailed"
The Nightingale,"The Nightingale {prompt}, Drama, revenge, colonial Tasmania, highly detailed","romantic comedy, forgiveness, modern California, undetailed"
Yesterday,"Yesterday {prompt}, Comedy, music, The Beatles, highly detailed","drama, silence, unknown band, undetailed"
Doctor Sleep,"Doctor Sleep {prompt}, Horror, supernatural, The Shining sequel, highly detailed","romantic comedy, natural, standalone story, undetailed"
The Farewell,"The Farewell {prompt}, Drama, family, terminal illness, highly detailed","romantic comedy, friends, good health, undetailed"
John Wick 3,"John Wick 3 {prompt}, Action, assassin, relentless pursuit, highly detailed","romantic comedy, pacifist, peaceful life, undetailed"
Us,"Us {prompt}, Horror, doppelgangers, underground, highly detailed","romantic comedy, identical twins, above ground, undetailed"
The Irishman,"The Irishman {prompt}, Crime, mobster, union, highly detailed","romantic comedy, law-abiding citizen, small business, undetailed"
